{
  "schema_version": "model-skyline/v1alpha1",
  "kind": "frontier",
  "hash_algorithm": "sha256-rfc8785-v1",
  "snapshot_id": "20666898e576663d8eedb82209c30fbc32d3356a1a265f48abcff49a9865999f",
  "config_hash": "ebbc40d00e36b0e46040b509f183f992d9f2c0070609bcbfb88defb8d49c345d",
  "catalog_hash": "c2dcfe7feac9b6f385bab0d97d3cfc212c89c89844d6704f2a73f41077b72201",
  "engine_version": "0.9.0",
  "generated_at": "2026-09-15T20:08:00Z",
  "frontier_id": "validated-capacity-latency-screen",
  "workload": {
    "id": "validated-capacity-v1",
    "version": "1",
    "unit": "context_position"
  },
  "order_by": "validated_context_screen",
  "uncertainty": "point",
  "axes": [
    {
      "metric": "validated_context_screen",
      "goal": "maximize",
      "unit": "token",
      "epsilon_absolute": "0",
      "epsilon_relative": "0.02"
    },
    {
      "metric": "end_to_end_screen",
      "goal": "minimize",
      "unit": "s",
      "epsilon_absolute": "0",
      "epsilon_relative": "0.05"
    }
  ],
  "members": [
    {
      "offering": {
        "offering_id": "local/inference-vm-rtx5060ti16/Qwen/Qwen3.5-9B@gguf-Q6_K-llama.cpp-d2ea6b0ddf6419e2",
        "model_id": "Qwen/Qwen3.5-9B",
        "provider": "local:inference-vm-rtx5060ti16",
        "endpoint": null,
        "billing_mode": "owned_hardware",
        "region": "local",
        "service_tier": "nvidia-default-180w-limit",
        "quantization": "Q6_K",
        "reasoning_effort": null,
        "agent_harness": "model-skyline/openai-matrix@v1",
        "capabilities": [
          "long-context",
          "text",
          "tools"
        ]
      },
      "axes": {
        "validated_context_screen": {
          "value": "126002",
          "unit": "token",
          "evidence_tiers": [
            "measured"
          ],
          "lower": null,
          "upper": null,
          "dependencies": [
            "signals.local_validated_context_tokens"
          ],
          "source_ids": [
            "local-measurement:qwen35-9b-q6k-5060-retrieval-mid-service-p126000-o64-miss-needle-0p5"
          ],
          "sources": [
            {
              "id": "local-measurement:qwen35-9b-q6k-5060-retrieval-mid-service-p126000-o64-miss-needle-0p5",
              "version": "model-skyline/openai-matrix@v1",
              "url": null,
              "terms_url": null,
              "license": "CC0-1.0",
              "methodology": "Serial streaming OpenAI-compatible requests at one exact prompt/output/mode/cache position; client TTFT, completion latency, usage, output digest, and tool parsing retained.",
              "raw_sha256": "f32c535fc0bb7f289eec044673f9f6b64c9e7a658cde1feecb6ccdaa1e4e02c2",
              "retrieved_at": "2026-09-15T19:49:23.007251Z"
            }
          ],
          "oldest_observed_at": "2026-09-15T19:49:23.007251Z",
          "minimum_sample_count": 1
        },
        "end_to_end_screen": {
          "value": "72.102637585",
          "unit": "s",
          "evidence_tiers": [
            "measured"
          ],
          "lower": "72.102637585",
          "upper": "72.102637585",
          "dependencies": [
            "signals.local_end_to_end_seconds"
          ],
          "source_ids": [
            "local-measurement:qwen35-9b-q6k-5060-retrieval-mid-service-p126000-o64-miss-needle-0p5"
          ],
          "sources": [
            {
              "id": "local-measurement:qwen35-9b-q6k-5060-retrieval-mid-service-p126000-o64-miss-needle-0p5",
              "version": "model-skyline/openai-matrix@v1",
              "url": null,
              "terms_url": null,
              "license": "CC0-1.0",
              "methodology": "Serial streaming OpenAI-compatible requests at one exact prompt/output/mode/cache position; client TTFT, completion latency, usage, output digest, and tool parsing retained.",
              "raw_sha256": "f32c535fc0bb7f289eec044673f9f6b64c9e7a658cde1feecb6ccdaa1e4e02c2",
              "retrieved_at": "2026-09-15T19:49:23.007251Z"
            }
          ],
          "oldest_observed_at": "2026-09-15T19:49:23.007251Z",
          "minimum_sample_count": 1
        }
      },
      "metadata": {
        "hardware": {
          "hardware_id": "inference-vm-rtx5060ti16",
          "manufacturer": "custom",
          "machine_model": "Proxmox-VM-125",
          "chip": "Intel-i7-14700K-plus-RTX-5060-Ti-16GB",
          "architecture": "x86_64",
          "memory_bytes": 10350514176,
          "cpu_cores": 16,
          "cpu_core_groups": {
            "kvm-passthrough-vcpu": 16
          },
          "gpu_cores": 4608,
          "os_name": "Ubuntu",
          "os_version": "22.04.5-LTS-kernel-5.15.0-190-generic",
          "power_source": "unknown",
          "power_mode": "nvidia-default-180w-limit",
          "negotiated_adapter_watts": null,
          "metadata": {
            "accelerator": "NVIDIA GeForce RTX 5060 Ti",
            "accelerator_architecture": "Blackwell",
            "accelerator_core_unit": "CUDA-core",
            "accelerator_memory_bytes_reported_by_nvidia_smi": 17103323136,
            "accelerator_memory_mib_reported_by_nvidia_smi": 16311,
            "accelerator_uuid": "GPU-029ff01b-22d2-691f-0848-5c84f28f9dfa",
            "cuda_capability": "12.0",
            "driver_version": "580.167.08",
            "gpu_power_limit_watts": 180,
            "hypervisor": "KVM",
            "inventory_observed_at": "2026-09-14T15:55:27Z",
            "nvidia_reference": "https://www.nvidia.com/en-us/geforce/graphics-cards/50-series/rtx-5060-family/"
          }
        },
        "artifact": {
          "model_id": "Qwen/Qwen3.5-9B",
          "checkpoint": "Qwen3.5-9B-Q6_K",
          "revision": "6cf6f4e2055a0793b88db06dc8965e066db0e9eb",
          "format": "gguf",
          "quantization": "Q6_K",
          "size_bytes": 7359230048,
          "content_sha256": "b4fed2983efc25bdc63c74f76bc5dfe8f3a434dfa45e1ba17aadecf19eb3161b",
          "source_url": "https://huggingface.co/eaddario/Qwen3.5-9B-GGUF/tree/6cf6f4e2055a0793b88db06dc8965e066db0e9eb",
          "license": "Apache-2.0",
          "metadata": {
            "filename": "Qwen3.5-9B-Q6_K.gguf",
            "base_model": "Qwen/Qwen3.5-9B",
            "text_only_without_mmproj": true,
            "legacy_runtime_file_type_label": "Q8_0",
            "quantization_identity_note": "The pinned artifact filename, publisher manifest, byte size, and SHA-256 identify Q6_K. llama.cpp build 2515 labels this Qwen3.5 artifact Q8_0 in model_type metadata."
          }
        },
        "runtime": {
          "runtime_id": "llama.cpp",
          "version": "0.4.0-dev-build-2515",
          "commit": "5266f24da",
          "backend": "CUDA",
          "context_capacity_tokens": 131072,
          "kv_cache": "q8_0/q8_0",
          "prefix_cache_enabled": true,
          "speculative_method": null,
          "agent_harness": "model-skyline/openai-matrix@v1",
          "configuration": {
            "runtime_binary_sha256": "7ce1f599eafb34e9c5c8edf6e7b018c5d4459bea3c5409865fa51c8b0798997d",
            "server_alias": "qwen35-9b-q6k-ctx128k-q8kv-load-none",
            "native_context_tokens": 262144,
            "allocated_context_tokens": 131072,
            "parallel_slots": 1,
            "batch_tokens": 2048,
            "micro_batch_tokens": 512,
            "threads": 6,
            "batch_threads": 6,
            "max_output_tokens": 16384,
            "n_gpu_layers": "all",
            "flash_attention": true,
            "fit": "off",
            "load_mode": "none",
            "jinja": true,
            "cache_ram_bytes": 0,
            "slot_prefix_reuse": "longest-common-prefix",
            "prompt_cache_enabled": true,
            "reasoning": "off",
            "exclusive_runner": "model-skyline/local-model-exclusive@linux-flock"
          }
        },
        "service_memory": {
          "schema_version": "model-skyline/experimental-service-memory/v2alpha1",
          "memory_architecture": "linux_split_cuda",
          "peak_service_capacity_bytes": 11716790272,
          "host_bytes_at_service_peak": 1967130624,
          "accelerator_bytes_at_service_peak": 9749659648,
          "peak_host_swap_growth_bytes": 1048576,
          "sample_count": 1009,
          "raw_artifact_path": "raw/qwen35-9b-q6k-128k-q8kv-service-memory-v2-load-none-linuxswap-alias.json",
          "raw_sha256": "4c87da1a745942ba27a523ad20f10e998d6fff77a86d0ab7d13d87cc28e25fbe",
          "workload_capture_sha256": "f32c535fc0bb7f289eec044673f9f6b64c9e7a658cde1feecb6ccdaa1e4e02c2"
        },
        "workload": {
          "reference": {
            "id": "openai-retrieval-p126000-o64-miss-needle-0p5",
            "version": "model-skyline/openai-matrix@v1",
            "unit": "request"
          },
          "kind": "long_context_retrieval",
          "input_definition_sha256": "94d636e2def3226d20169cfd3566b2ef97366874669fac0e97491ad629463c57",
          "requested_input_tokens": 126000,
          "max_output_tokens": 64,
          "repetitions": 1,
          "warmup_repetitions": 0,
          "concurrency": 1,
          "runner_state": "warm",
          "prefix_cache_state": "miss",
          "position": {
            "mode": "retrieval",
            "prompt_bytes": 193589,
            "user_prompt_sha256": "7e09964f9b3acdeda46eb5d97b36593ce8361a6a5ed99bae57dde2af01401287",
            "system_prompt_sha256": "18200944863667a568df30afd6c839a9115649ff796cb0310c25cfcc6d089a15",
            "tool_schema_sha256": null,
            "tool_count": 0,
            "tool_choice": null,
            "thinking_mode": "disabled",
            "sampling": {
              "temperature": 0,
              "seed": 90421
            },
            "time_to_first_token_source": "client-first-streamed-text-event",
            "decode_rate_source": "client-post-first-token-inter-token-rate",
            "token_count_url": "http://127.0.0.1:8091/v1/messages/count_tokens",